{
  "schema_version": 1,
  "protocol_version": "1.15.1",
  "kind": "verification_result",
  "result": "PASS",
  "exit_code": 0,
  "source": "checks_tsv",
  "summary": {
    "checks_defined": 2,
    "checks_run": 2,
    "required_run": 2,
    "passed": 2,
    "failed": 0,
    "optional_failed": 0,
    "blocked": 0,
    "optional_skipped": 0
  },
  "checks": [
    {
      "id": "staging-replay",
      "requirement": "required",
      "status": "PASS",
      "working_directory": ".",
      "exit_code": 0,
      "duration_ms": 1200,
      "reason_code": null
    },
    {
      "id": "audit-log-verify",
      "requirement": "required",
      "status": "PASS",
      "working_directory": ".",
      "exit_code": 0,
      "duration_ms": 2400,
      "reason_code": null
    }
  ]
}
